{
    "$schema": "https://json-schema.org/draft-07/schema#",
    "$id": "http://vivekpandey.com/langchain/mediation_log.schema.json",
    "type" : "object",
    "properties" : {
        "title" : {
            "type" : "string",
            "description" : "The title of the mediation log file."
        },
        "subtitle" : {
            "type" : "string",
            "description" : "The subtitle of the mediation log file"
        },
        "overview" : {
            "type" : "string",
            "description" : "A brief overview of the mediation log file"
        },
        "entries" : {
            "type" : "array",
            "description" : "An array of entries in the mediation log file",
            "items" : {
                "$ref": "./mediation_log_entry.schema.json"
            }
        }
    }
}